No.,Time,Source,Destination,Protocol,Length,Info,,,,,,,,,,,Time 1,Time 2,delay 1,delay 2,jitter,,,,,,Time 1,Time 2,delay,delay 2,jitter
1,0,192.168.100.11,34.98.74.57,TCP,54,"61118  >  443 [FIN, ACK] Seq=1 Ack=1 Win=509 Len=0",,,,,,,,,,,0,0.197458,0.197458,0.000147,0.197311,,,,,,0,0.197458,0.197458,0.000147,0.197311
4,0.197458,34.98.74.57,192.168.100.11,TCP,54,"443  >  61118 [FIN, ACK] Seq=1 Ack=2 Win=261 Len=0",,,,,,,,,,,0.197458,0.197605,0.000147,0.001802,-0.001655,,,,,,0.197458,0.197605,0.000147,0.001802,-0.001655
5,0.197605,192.168.100.11,34.98.74.57,TCP,54,61118  >  443 [ACK] Seq=2 Ack=2 Win=509 Len=0,,,,,,,,,,,0.197605,0.199407,0.001802,0.014994,-0.013192,,,,,,0.197605,0.199407,0.001802,0.014994,-0.013192
7,0.199407,192.168.100.11,35.186.224.13,TCP,66,61305  >  443 [SYN] Seq=0 Win=64240 Len=0 MSS=1460 WS=256 SACK_PERM=1,,,,,,,,,,,0.199407,0.214401,0.014994,0.000183,0.014811,,,,,,0.199407,0.214401,0.014994,0.000183,0.014811
8,0.214401,35.186.224.13,192.168.100.11,TCP,66,"443  >  61305 [SYN, ACK] Seq=0 Ack=1 Win=65535 Len=0 MSS=1412 SACK_PERM=1 WS=256",,,,,,,,,,,0.214401,0.214584,0.000183,0.000558,-0.000375,,,,,,0.214401,0.214584,0.000183,0.000558,-0.000375
9,0.214584,192.168.100.11,35.186.224.13,TCP,54,61305  >  443 [ACK] Seq=1 Ack=1 Win=131072 Len=0,,,,,,,,,,,0.214584,0.215142,0.000558,0.014353,-0.013795,,,,,,0.214584,0.215142,0.000558,0.014353,-0.013795
10,0.215142,192.168.100.11,35.186.224.13,TLSv1.3,650,Client Hello,,,,,,,,,,,0.215142,0.229495,0.014353,0.075657,-0.061304,,,,,,0.215142,0.229495,0.014353,0.075657,-0.061304
11,0.229495,35.186.224.13,192.168.100.11,TCP,54,443  >  61305 [ACK] Seq=1 Ack=597 Win=66816 Len=0,,,,,,,,,,,0.229495,0.305152,0.075657,0.018817,0.05684,,,,,,0.229495,0.305152,0.075657,0.018817,0.05684
12,0.305152,35.186.224.13,192.168.100.11,TLSv1.3,266,"Server Hello, Change Cipher Spec, Application Data",,,,,,,,,,,0.305152,0.323969,0.018817,0.000293,0.018524,,,,,,0.305152,0.323969,0.018817,0.000293,0.018524
13,0.323969,192.168.100.11,35.186.224.13,TLSv1.3,118,"Change Cipher Spec, Application Data",,,,,,,,,,,0.323969,0.324262,0.000293,0.000246,4.70E-05,,,,,,0.323969,0.324262,0.000293,0.000246,0.000047
14,0.324262,192.168.100.11,35.186.224.13,TLSv1.3,146,Application Data,,,,,,,,,,,0.324262,0.324508,0.000246,0.013765,-0.013519,,,,,,0.324262,0.324508,0.000246,0.013765,-0.013519
15,0.324508,192.168.100.11,35.186.224.13,TLSv1.3,1161,Application Data,,,,,,,,,,,0.324508,0.338273,0.013765,0.000113,0.013652,,,,,,0.324508,0.338273,0.013765,0.000113,0.013652
16,0.338273,35.186.224.13,192.168.100.11,TCP,56,443  >  61305 [ACK] Seq=213 Ack=753 Win=66816 Len=0,,,,,,,,,,,0.338273,0.338386,0.000113,0.000254,-0.000141,,,,,,0.338273,0.338386,0.000113,0.000254,-0.000141
17,0.338386,35.186.224.13,192.168.100.11,TCP,56,443  >  61305 [ACK] Seq=213 Ack=1860 Win=69632 Len=0,,,,,,,,,,,0.338386,0.33864,0.000254,0.000589,-0.000335,,,,,,0.338386,0.33864,0.000254,0.000589,-0.000335
18,0.33864,35.186.224.13,192.168.100.11,TCP,56,443  >  61305 [ACK] Seq=213 Ack=661 Win=66816 Len=0,,,,,,,,,,,0.33864,0.339229,0.000589,0.000201,0.000388,,,,,,0.33864,0.339229,0.000589,0.000201,0.000388
19,0.339229,35.186.224.13,192.168.100.11,TLSv1.3,634,"Application Data, Application Data",,,,,,,,,,,0.339229,0.33943,0.000201,0,0.000201,,,,,,0.339229,0.33943,0.000201,0,0.000201
20,0.33943,35.186.224.13,192.168.100.11,TLSv1.3,85,Application Data,,,,,,,,,,,0.33943,0.33943,0,0.044878,-0.044878,,,,,,0.33943,0.33943,0,0.044878,-0.044878
21,0.33943,192.168.100.11,35.186.224.13,TLSv1.3,85,Application Data,,,,,,,,,,,0.33943,0.384308,0.044878,0.017222,0.027656,,,,,,0.33943,0.384308,0.044878,0.017222,0.027656
22,0.384308,192.168.100.11,35.186.224.13,TCP,54,61305  >  443 [ACK] Seq=1891 Ack=824 Win=130304 Len=0,,,,,,,,,,,0.384308,0.40153,0.017222,0.013878,0.003344,,,,,,0.384308,0.40153,0.017222,0.013878,0.003344
23,0.40153,35.186.224.13,192.168.100.11,TCP,56,443  >  61305 [ACK] Seq=824 Ack=1891 Win=69632 Len=0,,,,,,,,,,,0.40153,0.415408,0.013878,0.000196,0.013682,,,,,,0.40153,0.415408,0.013878,0.000196,0.013682
24,0.415408,35.186.224.13,192.168.100.11,TLSv1.3,93,"[TCP Previous segment not captured] , Application Data",,,,,,,,,,,0.415408,0.415604,0.000196,0.000149,4.70E-05,,,,,,0.415408,0.415604,0.000196,0.000149,0.000047
25,0.415604,192.168.100.11,35.186.224.13,TCP,66,[TCP Dup ACK 22#1] 61305  >  443 [ACK] Seq=1891 Ack=824 Win=130304 Len=0 SLE=1687 SRE=1726,,,,,,,,,,,0.415604,0.415753,0.000149,0,0.000149,,,,,,0.415604,0.415753,0.000149,0,0.000149
26,0.415753,35.186.224.13,192.168.100.11,TCP,524,"[TCP Out-Of-Order] 443  >  61305 [PSH, ACK] Seq=824 Ack=1891 Win=69632 Len=470",,,,,,,,,,,0.415753,0.415753,0,6.60E-05,-6.60E-05,,,,,,0.415753,0.415753,0,6.60E-05,-0.000066
27,0.415753,35.186.224.13,192.168.100.11,TCP,447,"[TCP Out-Of-Order] 443  >  61305 [PSH, ACK] Seq=1294 Ack=1891 Win=69632 Len=393",,,,,,,,,,,0.415753,0.415819,6.60E-05,7.50E-05,-9.00E-06,,,,,,0.415753,0.415819,6.60E-05,7.50E-05,-9.00E-06
28,0.415819,192.168.100.11,35.186.224.13,TCP,66,61305  >  443 [ACK] Seq=1891 Ack=1294 Win=129792 Len=0 SLE=1687 SRE=1726,,,,,,,,,,,0.415819,0.415894,7.50E-05,0.000525,-0.00045,,,,,,0.415819,0.415894,7.50E-05,0.000525,-0.00045
29,0.415894,192.168.100.11,35.186.224.13,TCP,54,61305  >  443 [ACK] Seq=1891 Ack=1726 Win=131072 Len=0,,,,,,,,,,,0.415894,0.416419,0.000525,0.013227,-0.012702,,,,,,0.415894,0.416419,0.000525,0.013227,-0.012702
30,0.416419,192.168.100.11,35.186.224.13,TLSv1.3,93,Application Data,,,,,,,,,,,0.416419,0.429646,0.013227,0.471584,-0.458357,,,,,,0.416419,0.429646,0.013227,0.471584,-0.458357
31,0.429646,35.186.224.13,192.168.100.11,TCP,56,443  >  61305 [ACK] Seq=1726 Ack=1930 Win=69632 Len=0,,,,,,,,,,,0.429646,0.90123,0.471584,0.000132,0.471452,,,,,,0.429646,0.90123,0.471584,0.000132,0.471452
32,0.90123,192.168.100.11,35.186.224.25,TLSv1.2,136,Application Data,,,,,,,,,,,0.90123,0.901362,0.000132,0.02419,-0.024058,,,,,,0.90123,0.901362,0.000132,0.02419,-0.024058
33,0.901362,192.168.100.11,35.186.224.25,TLSv1.2,169,Application Data,,,,,,,,,,,0.901362,0.925552,0.02419,0.000359,0.023831,,,,,,0.901362,0.925552,0.02419,0.000359,0.023831
34,0.925552,35.186.224.25,192.168.100.11,TCP,56,443  >  61103 [ACK] Seq=1 Ack=83 Win=594 Len=0,,,,,,,,,,,0.925552,0.925911,0.000359,0.090804,-0.090445,,,,,,0.925552,0.925911,0.000359,0.090804,-0.090445
35,0.925911,35.186.224.25,192.168.100.11,TCP,56,443  >  61103 [ACK] Seq=1 Ack=198 Win=594 Len=0,,,,,,,,,,,0.925911,1.016715,0.090804,0.000617,0.090187,,,,,,0.925911,1.016715,0.090804,0.000617,0.090187
36,1.016715,35.186.224.25,192.168.100.11,TLSv1.2,129,Application Data,,,,,,,,,,,1.016715,1.017332,0.000617,0,0.000617,,,,,,1.016715,1.017332,0.000617,0,0.000617
37,1.017332,35.186.224.25,192.168.100.11,TLSv1.2,955,Application Data,,,,,,,,,,,1.017332,1.017332,0,0,0,,,,,,1.017332,1.017332,0,0,0
38,1.017332,35.186.224.25,192.168.100.11,TLSv1.2,238,Application Data,,,,,,,,,,,1.017332,1.017332,0,7.80E-05,-7.80E-05,,,,,,1.017332,1.017332,0,7.80E-05,-0.000078
39,1.017332,35.186.224.25,192.168.100.11,TLSv1.2,93,Application Data,,,,,,,,,,,1.017332,1.01741,7.80E-05,0.001171,-0.001093,,,,,,1.017332,1.01741,7.80E-05,0.001171,-0.001093
40,1.01741,192.168.100.11,35.186.224.25,TCP,54,61103  >  443 [ACK] Seq=198 Ack=1200 Win=512 Len=0,,,,,,,,,,,1.01741,1.018581,0.001171,0.012408,-0.011237,,,,,,1.01741,1.018581,0.001171,0.012408,-0.011237
41,1.018581,192.168.100.11,35.186.224.25,TLSv1.2,93,Application Data,,,,,,,,,,,1.018581,1.030989,0.012408,0.497893,-0.485485,,,,,,1.018581,1.030989,0.012408,0.497893,-0.485485
42,1.030989,35.186.224.25,192.168.100.11,TCP,56,443  >  61103 [ACK] Seq=1200 Ack=237 Win=594 Len=0,,,,,,,,,,,1.030989,1.528882,0.497893,0,0.497893,,,,,,1.030989,1.528882,0.497893,0,0.497893
43,1.528882,23.192.200.108,192.168.100.11,TLSv1.2,85,Encrypted Alert,,,,,,,,,,,1.528882,1.528882,0,0.00045,-0.00045,,,,,,1.528882,1.528882,0,0.00045,-0.00045
44,1.528882,23.192.200.108,192.168.100.11,TCP,54,"443  >  61289 [FIN, ACK] Seq=32 Ack=1 Win=501 Len=0",,,,,,,,,,,1.528882,1.529332,0.00045,0.000245,0.000205,,,,,,1.528882,1.529332,0.00045,0.000245,0.000205
45,1.529332,192.168.100.11,23.192.200.108,TCP,54,61289  >  443 [ACK] Seq=1 Ack=33 Win=1020 Len=0,,,,,,,,,,,1.529332,1.529577,0.000245,2.60E-05,0.000219,,,,,,1.529332,1.529577,0.000245,2.60E-05,0.000219
46,1.529577,23.192.200.108,192.168.100.11,TCP,54,"[TCP Out-Of-Order] 443  >  61289 [FIN, ACK] Seq=32 Ack=1 Win=501 Len=0",,,,,,,,,,,1.529577,1.529603,2.60E-05,5.016702,-5.016676,,,,,,1.529577,1.529603,2.60E-05,5.016702,-5.016676
47,1.529603,192.168.100.11,23.192.200.108,TCP,54,[TCP Dup ACK 45#1] 61289  >  443 [ACK] Seq=1 Ack=33 Win=1020 Len=0,,,,,,,,,,,1.529603,6.546305,5.016702,0.000227,5.016475,,,,,,1.529603,6.546305,5.016702,0.000227,5.016475
48,6.546305,117.18.237.29,192.168.100.11,TCP,54,"80  >  61208 [FIN, ACK] Seq=1 Ack=1 Win=65535 Len=0",,,,,,,,,,,6.546305,6.546532,0.000227,1.363628,-1.363401,,,,,,6.546305,6.546532,0.000227,1.363628,-1.363401
49,6.546532,192.168.100.11,117.18.237.29,TCP,54,61208  >  80 [ACK] Seq=1 Ack=2 Win=64952 Len=0,,,,,,,,,,,6.546532,7.91016,1.363628,5.40E-05,1.363574,,,,,,6.546532,7.91016,1.363628,5.40E-05,1.363574
50,7.91016,192.168.100.11,35.186.224.25,TLSv1.2,169,"[TCP Previous segment not captured] , Application Data",,,,,,,,,,,7.91016,7.910214,5.40E-05,0.081625,-0.081571,,,,,,7.91016,7.910214,5.40E-05,0.081625,-0.081571
51,7.910214,192.168.100.11,35.186.224.25,TCP,136,"[TCP Out-Of-Order] 61103  >  443 [PSH, ACK] Seq=237 Ack=1200 Win=512 Len=82",,,,,,,,,,,7.910214,7.991839,0.081625,0,0.081625,,,,,,7.910214,7.991839,0.081625,0,0.081625
52,7.991839,35.186.224.25,192.168.100.11,TCP,66,[TCP Window Update] 443  >  61103 [ACK] Seq=1200 Ack=237 Win=605 Len=0 SLE=319 SRE=434,,,,,,,,,,,7.991839,7.991839,0,0.090451,-0.090451,,,,,,7.991839,7.991839,0,0.090451,-0.090451
53,7.991839,35.186.224.25,192.168.100.11,TCP,56,443  >  61103 [ACK] Seq=1200 Ack=434 Win=605 Len=0,,,,,,,,,,,7.991839,8.08229,0.090451,0.000211,0.09024,,,,,,7.991839,8.08229,0.090451,0.000211,0.09024
54,8.08229,35.186.224.25,192.168.100.11,TLSv1.2,129,Application Data,,,,,,,,,,,8.08229,8.082501,0.000211,5.50E-05,0.000156,,,,,,8.08229,8.082501,0.000211,5.50E-05,0.000156
55,8.082501,35.186.224.25,192.168.100.11,TLSv1.2,842,Application Data,,,,,,,,,,,8.082501,8.082556,5.50E-05,0.000218,-0.000163,,,,,,8.082501,8.082556,5.50E-05,0.000218,-0.000163
56,8.082556,192.168.100.11,35.186.224.25,TCP,54,61103  >  443 [ACK] Seq=434 Ack=2063 Win=509 Len=0,,,,,,,,,,,8.082556,8.082774,0.000218,0,0.000218,,,,,,8.082556,8.082774,0.000218,0,0.000218
57,8.082774,35.186.224.25,192.168.100.11,TLSv1.2,283,Application Data,,,,,,,,,,,8.082774,8.082774,0,5.20E-05,-5.20E-05,,,,,,8.082774,8.082774,0,5.20E-05,-0.000052
58,8.082774,35.186.224.25,192.168.100.11,TLSv1.2,93,Application Data,,,,,,,,,,,8.082774,8.082826,5.20E-05,0.000884,-0.000832,,,,,,8.082774,8.082826,5.20E-05,0.000884,-0.000832
59,8.082826,192.168.100.11,35.186.224.25,TCP,54,61103  >  443 [ACK] Seq=434 Ack=2331 Win=508 Len=0,,,,,,,,,,,8.082826,8.08371,0.000884,0.012243,-0.011359,,,,,,8.082826,8.08371,0.000884,0.012243,-0.011359
60,8.08371,192.168.100.11,35.186.224.25,TLSv1.2,93,Application Data,,,,,,,,,,,8.08371,8.095953,0.012243,2.046893,-2.03465,,,,,,8.08371,8.095953,0.012243,2.046893,-2.03465
61,8.095953,35.186.224.25,192.168.100.11,TCP,56,443  >  61103 [ACK] Seq=2331 Ack=473 Win=605 Len=0,,,,,,,,,,,8.095953,10.142846,2.046893,0.101289,1.945604,,,,,,8.095953,10.142846,2.046893,0.101289,1.945604
62,10.142846,192.168.100.11,35.186.224.39,TLSv1.2,97,Application Data,,,,,,,,,,,10.142846,10.244135,0.101289,0.090928,0.010361,,,,,,10.142846,10.244135,0.101289,0.090928,0.010361
63,10.244135,35.186.224.39,192.168.100.11,TCP,54,443  >  61119 [ACK] Seq=1 Ack=44 Win=272 Len=0,,,,,,,,,,,10.244135,10.335063,0.090928,0.053085,0.037843,,,,,,10.244135,10.335063,0.090928,0.053085,0.037843
64,10.335063,35.186.224.39,192.168.100.11,TLSv1.2,94,Application Data,,,,,,,,,,,10.335063,10.388148,0.053085,0.529781,-0.476696,,,,,,10.335063,10.388148,0.053085,0.529781,-0.476696
65,10.388148,192.168.100.11,35.186.224.39,TCP,54,61119  >  443 [ACK] Seq=44 Ack=41 Win=511 Len=0,,,,,,,,,,,10.388148,10.917929,0.529781,0.000119,0.529662,,,,,,10.388148,10.917929,0.529781,0.000119,0.529662
66,10.917929,192.168.100.11,35.186.224.25,TLSv1.2,136,Application Data,,,,,,,,,,,10.917929,10.918048,0.000119,0.042704,-0.042585,,,,,,10.917929,10.918048,0.000119,0.042704,-0.042585
67,10.918048,192.168.100.11,35.186.224.25,TLSv1.2,169,Application Data,,,,,,,,,,,10.918048,10.960752,0.042704,0.000232,0.042472,,,,,,10.918048,10.960752,0.042704,0.000232,0.042472
68,10.960752,35.186.224.25,192.168.100.11,TCP,56,443  >  61103 [ACK] Seq=2331 Ack=555 Win=605 Len=0,,,,,,,,,,,10.960752,10.960984,0.000232,0.090849,-0.090617,,,,,,10.960752,10.960984,0.000232,0.090849,-0.090617
69,10.960984,35.186.224.25,192.168.100.11,TCP,56,443  >  61103 [ACK] Seq=2331 Ack=670 Win=605 Len=0,,,,,,,,,,,10.960984,11.051833,0.090849,0.00023,0.090619,,,,,,10.960984,11.051833,0.090849,0.00023,0.090619
70,11.051833,35.186.224.25,192.168.100.11,TLSv1.2,129,Application Data,,,,,,,,,,,11.051833,11.052063,0.00023,7.60E-05,0.000154,,,,,,11.051833,11.052063,0.00023,7.60E-05,0.000154
71,11.052063,35.186.224.25,192.168.100.11,TLSv1.2,977,Application Data,,,,,,,,,,,11.052063,11.052139,7.60E-05,0.000273,-0.000197,,,,,,11.052063,11.052139,7.60E-05,0.000273,-0.000197
72,11.052139,192.168.100.11,35.186.224.25,TCP,54,61103  >  443 [ACK] Seq=670 Ack=3329 Win=512 Len=0,,,,,,,,,,,11.052139,11.052412,0.000273,0,0.000273,,,,,,11.052139,11.052412,0.000273,0,0.000273
73,11.052412,35.186.224.25,192.168.100.11,TLSv1.2,216,Application Data,,,,,,,,,,,11.052412,11.052412,0,7.70E-05,-7.70E-05,,,,,,11.052412,11.052412,0,7.70E-05,-0.000077
74,11.052412,35.186.224.25,192.168.100.11,TLSv1.2,93,Application Data,,,,,,,,,,,11.052412,11.052489,7.70E-05,0.001006,-0.000929,,,,,,11.052412,11.052489,7.70E-05,0.001006,-0.000929
75,11.052489,192.168.100.11,35.186.224.25,TCP,54,61103  >  443 [ACK] Seq=670 Ack=3530 Win=512 Len=0,,,,,,,,,,,11.052489,11.053495,0.001006,0.012417,-0.011411,,,,,,11.052489,11.053495,0.001006,0.012417,-0.011411
76,11.053495,192.168.100.11,35.186.224.25,TLSv1.2,93,Application Data,,,,,,,,,,,11.053495,11.065912,0.012417,0.779711,-0.767294,,,,,,11.053495,11.065912,0.012417,0.779711,-0.767294
77,11.065912,35.186.224.25,192.168.100.11,TCP,56,443  >  61103 [ACK] Seq=3530 Ack=709 Win=605 Len=0,,,,,,,,,,,11.065912,11.845623,0.779711,0.128575,0.651136,,,,,,11.065912,11.845623,0.779711,0.128575,0.651136
85,11.845623,192.168.100.11,147.92.249.185,SSLv2,66,"Encrypted Data, Continuation Data",,,,,,,,,,,11.845623,11.974198,0.128575,0.00023,0.128345,,,,,,11.845623,11.974198,0.128575,0.00023,0.128345
87,11.974198,147.92.249.185,192.168.100.11,TCP,54,443  >  61136 [ACK] Seq=1 Ack=13 Win=32436 Len=0,,,,,,,,,,,11.974198,11.974428,0.00023,0.040067,-0.039837,,,,,,11.974198,11.974428,0.00023,0.040067,-0.039837
88,11.974428,147.92.249.185,192.168.100.11,SSLv2,66,"Encrypted Data, Continuation Data",,,,,,,,,,,11.974428,12.014495,0.040067,3.189658,-3.149591,,,,,,11.974428,12.014495,0.040067,3.189658,-3.149591
89,12.014495,192.168.100.11,147.92.249.185,TCP,54,61136  >  443 [ACK] Seq=13 Ack=13 Win=64468 Len=0,,,,,,,,,,,12.014495,15.204153,3.189658,0.252418,2.93724,,,,,,12.014495,15.204153,3.189658,0.252418,2.93724
93,15.204153,192.168.100.11,20.50.80.210,TCP,66,61313  >  443 [SYN] Seq=0 Win=65535 Len=0 MSS=1460 WS=256 SACK_PERM=1,,,,,,,,,,,15.204153,15.456571,0.252418,0.000207,0.252211,,,,,,15.204153,15.456571,0.252418,0.000207,0.252211
94,15.456571,20.50.80.210,192.168.100.11,TCP,66,"443  >  61313 [SYN, ACK] Seq=0 Ack=1 Win=65535 Len=0 MSS=1412 WS=256 SACK_PERM=1",,,,,,,,,,,15.456571,15.456778,0.000207,0.00051,-0.000303,,,,,,15.456571,15.456778,0.000207,0.00051,-0.000303
95,15.456778,192.168.100.11,20.50.80.210,TCP,54,61313  >  443 [ACK] Seq=1 Ack=1 Win=262144 Len=0,,,,,,,,,,,15.456778,15.457288,0.00051,0.202645,-0.202135,,,,,,15.456778,15.457288,0.00051,0.202645,-0.202135
96,15.457288,192.168.100.11,20.50.80.210,TLSv1.2,283,Client Hello,,,,,,,,,,,15.457288,15.659933,0.202645,0.000214,0.202431,,,,,,15.457288,15.659933,0.202645,0.000214,0.202431
97,15.659933,20.50.80.210,192.168.100.11,TCP,1466,443  >  61313 [ACK] Seq=1 Ack=230 Win=524800 Len=1412 [TCP segment of a reassembled PDU],,,,,,,,,,,15.659933,15.660147,0.000214,0.00019,2.40E-05,,,,,,15.659933,15.660147,0.000214,0.00019,0.000024
98,15.660147,192.168.100.11,20.50.80.210,TCP,54,61313  >  443 [ACK] Seq=230 Ack=1413 Win=262144 Len=0,,,,,,,,,,,15.660147,15.660337,0.00019,7.80E-05,0.000112,,,,,,15.660147,15.660337,0.00019,7.80E-05,0.000112
99,15.660337,20.50.80.210,192.168.100.11,TCP,1466,[TCP Previous segment not captured] 443  >  61313 [ACK] Seq=2825 Ack=230 Win=524800 Len=1412 [TCP segment of a reassembled PDU],,,,,,,,,,,15.660337,15.660415,7.80E-05,8.80E-05,-1.00E-05,,,,,,15.660337,15.660415,7.80E-05,8.80E-05,-0.00001
100,15.660415,192.168.100.11,20.50.80.210,TCP,66,[TCP Dup ACK 98#1] 61313  >  443 [ACK] Seq=230 Ack=1413 Win=262144 Len=0 SLE=2825 SRE=4237,,,,,,,,,,,15.660415,15.660503,8.80E-05,0,8.80E-05,,,,,,15.660415,15.660503,8.80E-05,0,0.000088
101,15.660503,20.50.80.210,192.168.100.11,TCP,1466,[TCP Out-Of-Order] 443  >  61313 [ACK] Seq=1413 Ack=230 Win=524800 Len=1412 [TCP segment of a reassembled PDU],,,,,,,,,,,15.660503,15.660503,0,0,0,,,,,,15.660503,15.660503,0,0,0
102,15.660503,20.50.80.210,192.168.100.11,TCP,1466,443  >  61313 [ACK] Seq=4237 Ack=230 Win=524800 Len=1412 [TCP segment of a reassembled PDU],,,,,,,,,,,15.660503,15.660503,0,8.40E-05,-8.40E-05,,,,,,15.660503,15.660503,0,8.40E-05,-0.000084
103,15.660503,20.50.80.210,192.168.100.11,TLSv1.2,630,"Server Hello, Certificate, Certificate Status, Server Key Exchange, Server Hello Done",,,,,,,,,,,15.660503,15.660587,8.40E-05,9.80E-05,-1.40E-05,,,,,,15.660503,15.660587,8.40E-05,9.80E-05,-0.000014
104,15.660587,192.168.100.11,20.50.80.210,TCP,54,61313  >  443 [ACK] Seq=230 Ack=4237 Win=262144 Len=0,,,,,,,,,,,15.660587,15.660685,9.80E-05,0.003588,-0.00349,,,,,,15.660587,15.660685,9.80E-05,0.003588,-0.00349
105,15.660685,192.168.100.11,20.50.80.210,TCP,54,61313  >  443 [ACK] Seq=230 Ack=6225 Win=262144 Len=0,,,,,,,,,,,15.660685,15.664273,0.003588,0.200528,-0.19694,,,,,,15.660685,15.664273,0.003588,0.200528,-0.19694
106,15.664273,192.168.100.11,20.50.80.210,TLSv1.2,212,"Client Key Exchange, Change Cipher Spec, Encrypted Handshake Message",,,,,,,,,,,15.664273,15.864801,0.200528,0.000141,0.200387,,,,,,15.664273,15.864801,0.200528,0.000141,0.200387
107,15.864801,20.50.80.210,192.168.100.11,TLSv1.2,105,"Change Cipher Spec, Encrypted Handshake Message",,,,,,,,,,,15.864801,15.864942,0.000141,0.000785,-0.000644,,,,,,15.864801,15.864942,0.000141,0.000785,-0.000644
108,15.864942,192.168.100.11,20.50.80.210,TCP,54,61313  >  443 [ACK] Seq=388 Ack=6276 Win=261888 Len=0,,,,,,,,,,,15.864942,15.865727,0.000785,0.202812,-0.202027,,,,,,15.864942,15.865727,0.000785,0.202812,-0.202027
109,15.865727,192.168.100.11,20.50.80.210,TLSv1.2,1086,Application Data,,,,,,,,,,,15.865727,16.068539,0.202812,0.000155,0.202657,,,,,,15.865727,16.068539,0.202812,0.000155,0.202657
111,16.068539,20.50.80.210,192.168.100.11,TLSv1.2,536,Application Data,,,,,,,,,,,16.068539,16.068694,0.000155,0.46136,-0.461205,,,,,,16.068539,16.068694,0.000155,0.46136,-0.461205
112,16.068694,192.168.100.11,20.50.80.210,TCP,54,61313  >  443 [ACK] Seq=1420 Ack=6758 Win=261376 Len=0,,,,,,,,,,,16.068694,16.530054,0.46136,0.00014,0.46122,,,,,,16.068694,16.530054,0.46136,0.00014,0.46122
113,16.530054,192.168.100.11,35.186.224.25,TLSv1.2,136,Application Data,,,,,,,,,,,16.530054,16.530194,0.00014,0,0.00014,,,,,,16.530054,16.530194,0.00014,0,0.00014
114,16.530194,192.168.100.11,35.186.224.25,TCP,1466,61103  >  443 [ACK] Seq=791 Ack=3530 Win=512 Len=1412 [TCP segment of a reassembled PDU],,,,,,,,,,,16.530194,16.530194,0,0.06284,-0.06284,,,,,,16.530194,16.530194,0,0.06284,-0.06284
115,16.530194,192.168.100.11,35.186.224.25,TLSv1.2,660,Application Data,,,,,,,,,,,16.530194,16.593034,0.06284,0.000211,0.062629,,,,,,16.530194,16.593034,0.06284,0.000211,0.062629
116,16.593034,35.186.224.25,192.168.100.11,TCP,56,443  >  61103 [ACK] Seq=3530 Ack=791 Win=605 Len=0,,,,,,,,,,,16.593034,16.593245,0.000211,6.30E-05,0.000148,,,,,,16.593034,16.593245,0.000211,6.30E-05,0.000148
117,16.593245,35.186.224.25,192.168.100.11,TCP,56,443  >  61103 [ACK] Seq=3530 Ack=2203 Win=616 Len=0,,,,,,,,,,,16.593245,16.593308,6.30E-05,0.192884,-0.192821,,,,,,16.593245,16.593308,6.30E-05,0.192884,-0.192821
118,16.593308,35.186.224.25,192.168.100.11,TCP,56,443  >  61103 [ACK] Seq=3530 Ack=2809 Win=627 Len=0,,,,,,,,,,,16.593308,16.786192,0.192884,0.001304,0.19158,,,,,,16.593308,16.786192,0.192884,0.001304,0.19158
119,16.786192,35.186.224.25,192.168.100.11,TLSv1.2,140,Application Data,,,,,,,,,,,16.786192,16.787496,0.001304,0.003381,-0.002077,,,,,,16.786192,16.787496,0.001304,0.003381,-0.002077
120,16.787496,192.168.100.11,35.186.224.25,TLSv1.2,93,Application Data,,,,,,,,,,,16.787496,16.790877,0.003381,9.50E-05,0.003286,,,,,,16.787496,16.790877,0.003381,9.50E-05,0.003286
121,16.790877,192.168.100.11,35.186.224.25,TLSv1.2,136,Application Data,,,,,,,,,,,16.790877,16.790972,9.50E-05,0,9.50E-05,,,,,,16.790877,16.790972,9.50E-05,0,0.000095
122,16.790972,192.168.100.11,35.186.224.25,TCP,1466,61103  >  443 [ACK] Seq=2930 Ack=3616 Win=511 Len=1412 [TCP segment of a reassembled PDU],,,,,,,,,,,16.790972,16.790972,0,0.009554,-0.009554,,,,,,16.790972,16.790972,0,0.009554,-0.009554
123,16.790972,192.168.100.11,35.186.224.25,TLSv1.2,480,Application Data,,,,,,,,,,,16.790972,16.800526,0.009554,0.00283,0.006724,,,,,,16.790972,16.800526,0.009554,0.00283,0.006724
124,16.800526,35.186.224.25,192.168.100.11,TCP,56,443  >  61103 [ACK] Seq=3616 Ack=2848 Win=627 Len=0,,,,,,,,,,,16.800526,16.803356,0.00283,0.000995,0.001835,,,,,,16.800526,16.803356,0.00283,0.000995,0.001835
125,16.803356,35.186.224.25,192.168.100.11,TCP,56,443  >  61103 [ACK] Seq=3616 Ack=2930 Win=627 Len=0,,,,,,,,,,,16.803356,16.804351,0.000995,4.60E-05,0.000949,,,,,,16.803356,16.804351,0.000995,4.60E-05,0.000949
126,16.804351,35.186.224.25,192.168.100.11,TCP,56,443  >  61103 [ACK] Seq=3616 Ack=4342 Win=638 Len=0,,,,,,,,,,,16.804351,16.804397,4.60E-05,0.186955,-0.186909,,,,,,16.804351,16.804397,4.60E-05,0.186955,-0.186909
127,16.804397,35.186.224.25,192.168.100.11,TCP,56,443  >  61103 [ACK] Seq=3616 Ack=4768 Win=649 Len=0,,,,,,,,,,,16.804397,16.991352,0.186955,0.001261,0.185694,,,,,,16.804397,16.991352,0.186955,0.001261,0.185694
128,16.991352,35.186.224.25,192.168.100.11,TLSv1.2,140,Application Data,,,,,,,,,,,16.991352,16.992613,0.001261,0.013258,-0.011997,,,,,,16.991352,16.992613,0.001261,0.013258,-0.011997
129,16.992613,192.168.100.11,35.186.224.25,TLSv1.2,93,Application Data,,,,,,,,,,,16.992613,17.005871,0.013258,0.06576,-0.052502,,,,,,16.992613,17.005871,0.013258,0.06576,-0.052502
130,17.005871,35.186.224.25,192.168.100.11,TCP,56,443  >  61103 [ACK] Seq=3702 Ack=4807 Win=649 Len=0,,,,,,,,,,,17.005871,17.071631,0.06576,0.034331,0.031429,,,,,,17.005871,17.071631,0.06576,0.034331,0.031429
131,17.071631,192.168.100.11,130.211.8.39,TCP,55,61282  >  443 [ACK] Seq=1 Ack=1 Win=508 Len=1 [TCP segment of a reassembled PDU],,,,,,,,,,,17.071631,17.105962,0.034331,1.700063,-1.665732,,,,,,17.071631,17.105962,0.034331,1.700063,-1.665732
132,17.105962,130.211.8.39,192.168.100.11,TCP,66,443  >  61282 [ACK] Seq=1 Ack=2 Win=261 Len=0 SLE=1 SRE=2,,,,,,,,,,,17.105962,18.806025,1.700063,0.000195,1.699868,,,,,,17.105962,18.806025,1.700063,0.000195,1.699868
133,18.806025,192.168.100.11,35.197.154.200,TCP,54,"61192  >  443 [FIN, ACK] Seq=1 Ack=1 Win=510 Len=0",,,,,,,,,,,18.806025,18.80622,0.000195,0.046467,-0.046272,,,,,,18.806025,18.80622,0.000195,0.046467,-0.046272
134,18.80622,192.168.100.11,35.197.154.200,TCP,54,"61192  >  443 [RST, ACK] Seq=2 Ack=1 Win=0 Len=0",,,,,,,,,,,18.80622,18.852687,0.046467,0.007534,0.038933,,,,,,18.80622,18.852687,0.046467,0.007534,0.038933
138,18.852687,192.168.100.11,13.33.28.10,TCP,66,61316  >  443 [SYN] Seq=0 Win=64240 Len=0 MSS=1460 WS=256 SACK_PERM=1,,,,,,,,,,,18.852687,18.860221,0.007534,0.007729,-0.000195,,,,,,18.852687,18.860221,0.007534,0.007729,-0.000195
140,18.860221,35.197.154.200,192.168.100.11,TCP,54,443  >  61192 [RST] Seq=1 Win=0 Len=0,,,,,,,,,,,18.860221,18.86795,0.007729,0.000123,0.007606,,,,,,18.860221,18.86795,0.007729,0.000123,0.007606
141,18.86795,13.33.28.10,192.168.100.11,TCP,58,"443  >  61316 [SYN, ACK] Seq=0 Ack=1 Win=4380 Len=0 MSS=1412",,,,,,,,,,,18.86795,18.868073,0.000123,0.000438,-0.000315,,,,,,18.86795,18.868073,0.000123,0.000438,-0.000315
142,18.868073,192.168.100.11,13.33.28.10,TCP,54,61316  >  443 [ACK] Seq=1 Ack=1 Win=64240 Len=0,,,,,,,,,,,18.868073,18.868511,0.000438,0.068283,-0.067845,,,,,,18.868073,18.868511,0.000438,0.068283,-0.067845
143,18.868511,192.168.100.11,13.33.28.10,TLSv1.3,571,Client Hello,,,,,,,,,,,18.868511,18.936794,0.068283,0.000469,0.067814,,,,,,18.868511,18.936794,0.068283,0.000469,0.067814
144,18.936794,13.33.28.10,192.168.100.11,TCP,58,[TCP Window Update] 443  >  61316 [ACK] Seq=1 Ack=1 Win=65535 Len=0,,,,,,,,,,,18.936794,18.937263,0.000469,0.000199,0.00027,,,,,,18.936794,18.937263,0.000469,0.000199,0.00027
145,18.937263,13.33.28.10,192.168.100.11,TCP,56,443  >  61316 [ACK] Seq=1 Ack=518 Win=65535 Len=0,,,,,,,,,,,18.937263,18.937462,0.000199,0,0.000199,,,,,,18.937263,18.937462,0.000199,0,0.000199
146,18.937462,13.33.28.10,192.168.100.11,TLSv1.3,1334,"Server Hello, Change Cipher Spec, Application Data",,,,,,,,,,,18.937462,18.937462,0,0,0,,,,,,18.937462,18.937462,0,0,0
147,18.937462,13.33.28.10,192.168.100.11,TCP,1334,"[TCP Previous segment not captured] 443  >  61316 [PSH, ACK] Seq=3841 Ack=518 Win=65535 Len=1280 [TCP segment of a reassembled PDU]",,,,,,,,,,,18.937462,18.937462,0,0,0,,,,,,18.937462,18.937462,0,0,0
148,18.937462,13.33.28.10,192.168.100.11,TCP,1334,[TCP Out-Of-Order] 443  >  61316 [ACK] Seq=1281 Ack=518 Win=65535 Len=1280 [TCP segment of a reassembled PDU],,,,,,,,,,,18.937462,18.937462,0,0,0,,,,,,18.937462,18.937462,0,0,0
149,18.937462,13.33.28.10,192.168.100.11,TCP,1334,[TCP Out-Of-Order] 443  >  61316 [ACK] Seq=2561 Ack=518 Win=65535 Len=1280 [TCP segment of a reassembled PDU],,,,,,,,,,,18.937462,18.937462,0,7.90E-05,-7.90E-05,,,,,,18.937462,18.937462,0,7.90E-05,-0.000079
150,18.937462,13.33.28.10,192.168.100.11,TLSv1.3,916,"Application Data, Application Data, Application Data",,,,,,,,,,,18.937462,18.937541,7.90E-05,9.00E-05,-1.10E-05,,,,,,18.937462,18.937541,7.90E-05,9.00E-05,-0.000011
151,18.937541,192.168.100.11,13.33.28.10,TCP,54,61316  >  443 [ACK] Seq=518 Ack=1281 Win=64952 Len=0,,,,,,,,,,,18.937541,18.937631,9.00E-05,4.70E-05,4.30E-05,,,,,,18.937541,18.937631,9.00E-05,4.70E-05,0.000043
152,18.937631,192.168.100.11,13.33.28.10,TCP,54,61316  >  443 [ACK] Seq=518 Ack=2561 Win=63672 Len=0,,,,,,,,,,,18.937631,18.937678,4.70E-05,3.60E-05,1.10E-05,,,,,,18.937631,18.937678,4.70E-05,3.60E-05,0.000011
153,18.937678,192.168.100.11,13.33.28.10,TCP,54,61316  >  443 [ACK] Seq=518 Ack=5121 Win=64952 Len=0,,,,,,,,,,,18.937678,18.937714,3.60E-05,0.000303,-0.000267,,,,,,18.937678,18.937714,3.60E-05,0.000303,-0.000267
154,18.937714,192.168.100.11,13.33.28.10,TCP,54,61316  >  443 [ACK] Seq=518 Ack=5983 Win=64090 Len=0,,,,,,,,,,,18.937714,18.938017,0.000303,0.000229,7.40E-05,,,,,,18.937714,18.938017,0.000303,0.000229,0.000074
155,18.938017,192.168.100.11,13.33.28.10,TLSv1.3,118,"Change Cipher Spec, Application Data",,,,,,,,,,,18.938017,18.938246,0.000229,0.000178,5.10E-05,,,,,,18.938017,18.938246,0.000229,0.000178,0.000051
156,18.938246,192.168.100.11,13.33.28.10,TLSv1.3,146,Application Data,,,,,,,,,,,18.938246,18.938424,0.000178,0.050378,-0.0502,,,,,,18.938246,18.938424,0.000178,0.050378,-0.0502
157,18.938424,192.168.100.11,13.33.28.10,TLSv1.3,470,Application Data,,,,,,,,,,,18.938424,18.988802,0.050378,0.049228,0.00115,,,,,,18.938424,18.988802,0.050378,0.049228,0.00115
158,18.988802,192.168.100.11,104.199.240.237,TCP,65,"61085  >  4070 [PSH, ACK] Seq=1 Ack=1 Win=513 Len=11",,,,,,,,,,,18.988802,19.03803,0.049228,0.000163,0.049065,,,,,,18.988802,19.03803,0.049228,0.000163,0.049065
159,19.03803,13.33.28.10,192.168.100.11,TCP,56,443  >  61316 [ACK] Seq=5983 Ack=582 Win=65535 Len=0,,,,,,,,,,,19.03803,19.038193,0.000163,,,,,,,,19.03803,19.038193,0.000163,0.000189,-0.000026
160,19.038193,13.33.28.10,192.168.100.11,TLSv1.3,116,Application Data,,,,,,,,,,,,,,,,,,,,,19.038193,19.038382,0.000189,0.000122,0.000067
161,19.038382,192.168.100.11,13.33.28.10,TLSv1.3,85,Application Data,,,,,,,,,,,,tot delay,19.038193,tot jitter,0.197295,,,,,,19.038382,19.038504,0.000122,0,0.000122
162,19.038504,13.33.28.10,192.168.100.11,TCP,56,443  >  61316 [ACK] Seq=6045 Ack=674 Win=65535 Len=0,,,,,,,,,,,,rata2 delay,0.135987,rata2 jitter,0.001419388,,,,,,19.038504,19.038504,0,0,0
163,19.038504,13.33.28.10,192.168.100.11,TLSv1.3,85,Application Data,,,,,,,,,,,,,,,,,,,,,19.038504,19.038504,0,0,0
164,19.038504,13.33.28.10,192.168.100.11,TCP,56,443  >  61316 [ACK] Seq=6076 Ack=1090 Win=65535 Len=0,,,,,,,,,,,,,,,,,,,,,19.038504,19.038504,0,7.00E-05,-0.00007
165,19.038504,13.33.28.10,192.168.100.11,TLSv1.3,392,Application Data,,,,,,,,,,,,,,,,,,,,,19.038504,19.038574,7.00E-05,0.023405,-0.023335
166,19.038574,192.168.100.11,13.33.28.10,TCP,54,61316  >  443 [ACK] Seq=1121 Ack=6414 Win=63659 Len=0,,,,,,,,,,,,,,,,,,,,,19.038574,19.061979,0.023405,0.055868,-0.032463
168,19.061979,13.33.28.10,192.168.100.11,TCP,56,443  >  61316 [ACK] Seq=6414 Ack=1121 Win=65535 Len=0,,,,,,,,,,,,,,,,,,,,,19.061979,19.117847,0.055868,0.000129,0.055739
169,19.117847,192.168.100.11,35.186.224.25,TLSv1.2,125,Application Data,,,,,,,,,,,,,,,,,,,,,19.117847,19.117976,0.000129,0,0.000129
170,19.117976,192.168.100.11,35.186.224.25,TCP,1466,61103  >  443 [ACK] Seq=4878 Ack=3702 Win=511 Len=1412 [TCP segment of a reassembled PDU],,,,,,,,,,,,,,,,,,,,,19.117976,19.117976,0,0.034416,-0.034416
171,19.117976,192.168.100.11,35.186.224.25,TLSv1.2,186,Application Data,,,,,,,,,,,,,,,,,,,,,19.117976,19.152392,0.034416,0.001794,0.032622
172,19.152392,104.199.240.237,192.168.100.11,TCP,54,4070  >  61085 [ACK] Seq=1 Ack=12 Win=16 Len=0,,,,,,,,,,,,,,,,,,,,,19.152392,19.154186,0.001794,0.000223,0.001571
173,19.154186,35.186.224.25,192.168.100.11,TCP,56,443  >  61103 [ACK] Seq=3702 Ack=4878 Win=649 Len=0,,,,,,,,,,,,,,,,,,,,,19.154186,19.154409,0.000223,0.000107,0.000116
174,19.154409,35.186.224.25,192.168.100.11,TCP,56,443  >  61103 [ACK] Seq=3702 Ack=6290 Win=660 Len=0,,,,,,,,,,,,,,,,,,,,,19.154409,19.154516,0.000107,0.008714,-0.008607
175,19.154516,35.186.224.25,192.168.100.11,TCP,56,443  >  61103 [ACK] Seq=3702 Ack=6422 Win=671 Len=0,,,,,,,,,,,,,,,,,,,,,19.154516,19.16323,0.008714,0.044128,-0.035414
176,19.16323,104.199.240.237,192.168.100.11,TCP,65,"4070  >  61085 [PSH, ACK] Seq=1 Ack=12 Win=16 Len=11",,,,,,,,,,,,,,,,,,,,,19.16323,19.207358,0.044128,0.141064,-0.096936
178,19.207358,192.168.100.11,104.199.240.237,TCP,54,61085  >  4070 [ACK] Seq=12 Ack=12 Win=513 Len=0,,,,,,,,,,,,,,,,,,,,,19.207358,19.348422,0.141064,0.100311,0.040753
181,19.348422,192.168.100.11,35.247.144.219,TLSv1.2,317,Application Data,,,,,,,,,,,,,,,,,,,,,19.348422,19.448733,0.100311,0.001228,0.099083
182,19.448733,35.247.144.219,192.168.100.11,TLSv1.2,139,Application Data,,,,,,,,,,,,,,,,,,,,,19.448733,19.449961,0.001228,0.052256,-0.051028
183,19.449961,192.168.100.11,20.50.73.10,TCP,66,61317  >  443 [SYN] Seq=0 Win=65535 Len=0 MSS=1460 WS=256 SACK_PERM=1,,,,,,,,,,,,,,,,,,,,,19.449961,19.502217,0.052256,0.151354,-0.099098
184,19.502217,192.168.100.11,35.247.144.219,TCP,54,61076  >  443 [ACK] Seq=264 Ack=86 Win=511 Len=0,,,,,,,,,,,,,,,,,,,,,19.502217,19.653571,0.151354,0.00022,0.151134
185,19.653571,20.50.73.10,192.168.100.11,TCP,66,"443  >  61317 [SYN, ACK] Seq=0 Ack=1 Win=65535 Len=0 MSS=1412 WS=256 SACK_PERM=1",,,,,,,,,,,,,,,,,,,,,19.653571,19.653791,0.00022,0.00039,-0.00017
186,19.653791,192.168.100.11,20.50.73.10,TCP,54,61317  >  443 [ACK] Seq=1 Ack=1 Win=262144 Len=0,,,,,,,,,,,,,,,,,,,,,19.653791,19.654181,0.00039,0.011283,-0.010893
187,19.654181,192.168.100.11,20.50.73.10,TLSv1.2,283,Client Hello,,,,,,,,,,,,,,,,,,,,,19.654181,19.665464,0.011283,0.000152,0.011131
188,19.665464,35.186.224.25,192.168.100.11,TLSv1.2,1466,"[TCP Previous segment not captured] , Application Data",,,,,,,,,,,,,,,,,,,,,19.665464,19.665616,0.000152,0.000659,-0.000507
189,19.665616,192.168.100.11,35.186.224.25,TCP,66,[TCP Dup ACK 129#1] 61103  >  443 [ACK] Seq=6422 Ack=3702 Win=511 Len=0 SLE=3777 SRE=5189,,,,,,,,,,,,,,,,,,,,,19.665616,19.666275,0.000659,0,0.000659
190,19.666275,35.186.224.25,192.168.100.11,TCP,129,"[TCP Out-Of-Order] 443  >  61103 [PSH, ACK] Seq=3702 Ack=6422 Win=671 Len=75",,,,,,,,,,,,,,,,,,,,,19.666275,19.666275,0,0,0
191,19.666275,35.186.224.25,192.168.100.11,TLSv1.2,1466,Application Data,,,,,,,,,,,,,,,,,,,,,19.666275,19.666275,0,0,0
192,19.666275,35.186.224.25,192.168.100.11,TLSv1.2,1450,Application Data,,,,,,,,,,,,,,,,,,,,,19.666275,19.666275,0,7.30E-05,-0.000073
193,19.666275,35.186.224.25,192.168.100.11,TLSv1.2,1466,Application Data,,,,,,,,,,,,,,,,,,,,,19.666275,19.666348,7.30E-05,5.40E-05,0.000019
194,19.666348,192.168.100.11,35.186.224.25,TCP,54,61103  >  443 [ACK] Seq=6422 Ack=5189 Win=512 Len=0,,,,,,,,,,,,,,,,,,,,,19.666348,19.666402,5.40E-05,0.000123,-0.000069
195,19.666402,192.168.100.11,35.186.224.25,TCP,54,61103  >  443 [ACK] Seq=6422 Ack=9409 Win=512 Len=0,,,,,,,,,,,,,,,,,,,,,19.666402,19.666525,0.000123,2.50E-05,0.000098
196,19.666525,35.186.224.25,192.168.100.11,TLSv1.2,1466,Application Data,,,,,,,,,,,,,,,,,,,,,19.666525,19.66655,2.50E-05,0.001031,-0.001006
197,19.66655,192.168.100.11,35.186.224.25,TCP,54,61103  >  443 [ACK] Seq=6422 Ack=10821 Win=512 Len=0,,,,,,,,,,,,,,,,,,,,,19.66655,19.667581,0.001031,0.000143,0.000888
198,19.667581,35.186.224.25,192.168.100.11,TLSv1.2,1466,Application Data,,,,,,,,,,,,,,,,,,,,,19.667581,19.667724,0.000143,3.50E-05,0.000108
199,19.667724,35.186.224.25,192.168.100.11,TLSv1.2,1466,Application Data,,,,,,,,,,,,,,,,,,,,,19.667724,19.667759,3.50E-05,0.00012,-0.000085
200,19.667759,192.168.100.11,35.186.224.25,TCP,54,61103  >  443 [ACK] Seq=6422 Ack=13645 Win=512 Len=0,,,,,,,,,,,,,,,,,,,,,19.667759,19.667879,0.00012,0.000441,-0.000321
201,19.667879,35.186.224.25,192.168.100.11,TLSv1.2,1466,Application Data,,,,,,,,,,,,,,,,,,,,,19.667879,19.66832,0.000441,0,0.000441
202,19.66832,35.186.224.25,192.168.100.11,TLSv1.2,1358,Application Data,,,,,,,,,,,,,,,,,,,,,19.66832,19.66832,0,3.50E-05,-0.000035
203,19.66832,35.186.224.25,192.168.100.11,TLSv1.2,1466,Application Data,,,,,,,,,,,,,,,,,,,,,19.66832,19.668355,3.50E-05,0.000159,-0.000124
204,19.668355,192.168.100.11,35.186.224.25,TCP,54,61103  >  443 [ACK] Seq=6422 Ack=17773 Win=512 Len=0,,,,,,,,,,,,,,,,,,,,,19.668355,19.668514,0.000159,2.70E-05,0.000132
205,19.668514,35.186.224.25,192.168.100.11,TLSv1.2,1466,Application Data,,,,,,,,,,,,,,,,,,,,,19.668514,19.668541,2.70E-05,0.000481,-0.000454
206,19.668541,192.168.100.11,35.186.224.25,TCP,54,61103  >  443 [ACK] Seq=6422 Ack=19185 Win=512 Len=0,,,,,,,,,,,,,,,,,,,,,19.668541,19.669022,0.000481,2.70E-05,0.000454
207,19.669022,35.186.224.25,192.168.100.11,TLSv1.2,99,"[TCP Previous segment not captured] , Application Data",,,,,,,,,,,,,,,,,,,,,19.669022,19.669049,2.70E-05,0.00025,-0.000223
208,19.669049,192.168.100.11,35.186.224.25,TCP,66,[TCP Dup ACK 206#1] 61103  >  443 [ACK] Seq=6422 Ack=19185 Win=512 Len=0 SLE=20597 SRE=20642,,,,,,,,,,,,,,,,,,,,,19.669049,19.669299,0.00025,2.50E-05,0.000225
209,19.669299,35.186.224.25,192.168.100.11,TCP,1466,[TCP Out-Of-Order] 443  >  61103 [ACK] Seq=19185 Ack=6422 Win=671 Len=1412,,,,,,,,,,,,,,,,,,,,,19.669299,19.669324,2.50E-05,0.002797,-0.002772
210,19.669324,192.168.100.11,35.186.224.25,TCP,54,61103  >  443 [ACK] Seq=6422 Ack=20642 Win=512 Len=0,,,,,,,,,,,,,,,,,,,,,19.669324,19.672121,0.002797,0.00023,0.002567
211,19.672121,35.186.224.25,192.168.100.11,TLSv1.2,1466,Application Data,,,,,,,,,,,,,,,,,,,,,19.672121,19.672351,0.00023,4.30E-05,0.000187
212,19.672351,35.186.224.25,192.168.100.11,TLSv1.2,1466,Application Data,,,,,,,,,,,,,,,,,,,,,19.672351,19.672394,4.30E-05,0.000194,-0.000151
213,19.672394,192.168.100.11,35.186.224.25,TCP,54,61103  >  443 [ACK] Seq=6422 Ack=23466 Win=512 Len=0,,,,,,,,,,,,,,,,,,,,,19.672394,19.672588,0.000194,0.000844,-0.00065
214,19.672588,35.186.224.25,192.168.100.11,TLSv1.2,1466,Application Data,,,,,,,,,,,,,,,,,,,,,19.672588,19.673432,0.000844,3.60E-05,0.000808
215,19.673432,35.186.224.25,192.168.100.11,TLSv1.2,1295,"Application Data, Application Data, Application Data",,,,,,,,,,,,,,,,,,,,,19.673432,19.673468,3.60E-05,6.40E-05,-0.000028
216,19.673468,192.168.100.11,35.186.224.25,TCP,54,61103  >  443 [ACK] Seq=6422 Ack=26119 Win=512 Len=0,,,,,,,,,,,,,,,,,,,,,19.673468,19.673532,6.40E-05,0.000404,-0.00034
217,19.673532,35.186.224.25,192.168.100.11,TLSv1.2,93,Application Data,,,,,,,,,,,,,,,,,,,,,19.673532,19.673936,0.000404,0.012421,-0.012017
218,19.673936,192.168.100.11,35.186.224.25,TLSv1.2,93,Application Data,,,,,,,,,,,,,,,,,,,,,19.673936,19.686357,0.012421,0.080096,-0.067675
219,19.686357,35.186.224.25,192.168.100.11,TCP,56,443  >  61103 [ACK] Seq=26158 Ack=6461 Win=671 Len=0,,,,,,,,,,,,,,,,,,,,,19.686357,19.766453,0.080096,0.000228,0.079868
220,19.766453,192.168.100.11,20.50.80.210,TLSv1.2,512,Application Data,,,,,,,,,,,,,,,,,,,,,19.766453,19.766681,0.000228,0,0.000228
221,19.766681,192.168.100.11,20.50.80.210,TCP,1466,61313  >  443 [ACK] Seq=1878 Ack=6758 Win=261376 Len=1412 [TCP segment of a reassembled PDU],,,,,,,,,,,,,,,,,,,,,19.766681,19.766681,0,0,0
222,19.766681,192.168.100.11,20.50.80.210,TCP,1466,61313  >  443 [ACK] Seq=3290 Ack=6758 Win=261376 Len=1412 [TCP segment of a reassembled PDU],,,,,,,,,,,,,,,,,,,,,19.766681,19.766681,0,0.091218,-0.091218
223,19.766681,192.168.100.11,20.50.80.210,TLSv1.2,560,Application Data,,,,,,,,,,,,,,,,,,,,,19.766681,19.857899,0.091218,0.000144,0.091074
224,19.857899,20.50.73.10,192.168.100.11,TCP,1466,443  >  61317 [ACK] Seq=1 Ack=230 Win=524800 Len=1412 [TCP segment of a reassembled PDU],,,,,,,,,,,,,,,,,,,,,19.857899,19.858043,0.000144,0.000139,5.00E-06
225,19.858043,192.168.100.11,20.50.73.10,TCP,54,61317  >  443 [ACK] Seq=230 Ack=1413 Win=262144 Len=0,,,,,,,,,,,,,,,,,,,,,19.858043,19.858182,0.000139,4.00E-05,0.000099
226,19.858182,20.50.73.10,192.168.100.11,TCP,1466,443  >  61317 [ACK] Seq=1413 Ack=230 Win=524800 Len=1412 [TCP segment of a reassembled PDU],,,,,,,,,,,,,,,,,,,,,19.858182,19.858222,4.00E-05,5.00E-05,-0.00001
227,19.858222,192.168.100.11,20.50.73.10,TCP,54,61317  >  443 [ACK] Seq=230 Ack=2825 Win=262144 Len=0,,,,,,,,,,,,,,,,,,,,,19.858222,19.858272,5.00E-05,0,0.00005
228,19.858272,20.50.73.10,192.168.100.11,TCP,1466,443  >  61317 [ACK] Seq=2825 Ack=230 Win=524800 Len=1412 [TCP segment of a reassembled PDU],,,,,,,,,,,,,,,,,,,,,19.858272,19.858272,0,0,0
229,19.858272,20.50.73.10,192.168.100.11,TCP,1466,443  >  61317 [ACK] Seq=4237 Ack=230 Win=524800 Len=1412 [TCP segment of a reassembled PDU],,,,,,,,,,,,,,,,,,,,,19.858272,19.858272,0,4.60E-05,-0.000046
230,19.858272,20.50.73.10,192.168.100.11,TLSv1.2,630,"Server Hello, Certificate, Certificate Status, Server Key Exchange, Server Hello Done",,,,,,,,,,,,,,,,,,,,,19.858272,19.858318,4.60E-05,0.010828,-0.010782
231,19.858318,192.168.100.11,20.50.73.10,TCP,54,61317  >  443 [ACK] Seq=230 Ack=6225 Win=262144 Len=0,,,,,,,,,,,,,,,,,,,,,19.858318,19.869146,0.010828,0.169673,-0.158845
232,19.869146,192.168.100.11,20.50.73.10,TLSv1.2,212,"Client Key Exchange, Change Cipher Spec, Encrypted Handshake Message",,,,,,,,,,,,,,,,,,,,,19.869146,20.038819,0.169673,0.023357,0.146316
